{
  "schema": "dna-premium-song-map",
  "version": "2.0",
  "source": {
    "fileName": "song19-01.mid",
    "bytes": 1235,
    "sha256": "c992893d6ab4ceb8ec0851212ab6212e734794c9b048887534b24dd2638e1833",
    "format": 1,
    "ppq": 480,
    "trackCount": 5,
    "noteCount": 118
  },
  "sourceSha256": "c992893d6ab4ceb8ec0851212ab6212e734794c9b048887534b24dd2638e1833",
  "ppq": 480,
  "endTick": 15350,
  "tempoMap": [
    {
      "tick": 0,
      "bpm": 83.999966,
      "microsecondsPerQuarter": 714286,
      "sourceTrackIndex": 0
    }
  ],
  "meterMap": [
    {
      "tick": 0,
      "numerator": 4,
      "denominator": 4,
      "sourceTrackIndex": 0
    }
  ],
  "bars": [
    {
      "bar": 1,
      "startTick": 0,
      "endTick": 1920,
      "numerator": 4,
      "denominator": 4
    },
    {
      "bar": 2,
      "startTick": 1920,
      "endTick": 3840,
      "numerator": 4,
      "denominator": 4
    },
    {
      "bar": 3,
      "startTick": 3840,
      "endTick": 5760,
      "numerator": 4,
      "denominator": 4
    },
    {
      "bar": 4,
      "startTick": 5760,
      "endTick": 7680,
      "numerator": 4,
      "denominator": 4
    },
    {
      "bar": 5,
      "startTick": 7680,
      "endTick": 9600,
      "numerator": 4,
      "denominator": 4
    },
    {
      "bar": 6,
      "startTick": 9600,
      "endTick": 11520,
      "numerator": 4,
      "denominator": 4
    },
    {
      "bar": 7,
      "startTick": 11520,
      "endTick": 13440,
      "numerator": 4,
      "denominator": 4
    },
    {
      "bar": 8,
      "startTick": 13440,
      "endTick": 15350,
      "numerator": 4,
      "denominator": 4
    }
  ],
  "beatGrid": [
    {
      "tick": 0,
      "bar": 1,
      "beat": 1,
      "downbeat": true,
      "numerator": 4,
      "denominator": 4
    },
    {
      "tick": 480,
      "bar": 1,
      "beat": 2,
      "downbeat": false,
      "numerator": 4,
      "denominator": 4
    },
    {
      "tick": 960,
      "bar": 1,
      "beat": 3,
      "downbeat": false,
      "numerator": 4,
      "denominator": 4
    },
    {
      "tick": 1440,
      "bar": 1,
      "beat": 4,
      "downbeat": false,
      "numerator": 4,
      "denominator": 4
    },
    {
      "tick": 1920,
      "bar": 2,
      "beat": 1,
      "downbeat": true,
      "numerator": 4,
      "denominator": 4
    },
    {
      "tick": 2400,
      "bar": 2,
      "beat": 2,
      "downbeat": false,
      "numerator": 4,
      "denominator": 4
    },
    {
      "tick": 2880,
      "bar": 2,
      "beat": 3,
      "downbeat": false,
      "numerator": 4,
      "denominator": 4
    },
    {
      "tick": 3360,
      "bar": 2,
      "beat": 4,
      "downbeat": false,
      "numerator": 4,
      "denominator": 4
    },
    {
      "tick": 3840,
      "bar": 3,
      "beat": 1,
      "downbeat": true,
      "numerator": 4,
      "denominator": 4
    },
    {
      "tick": 4320,
      "bar": 3,
      "beat": 2,
      "downbeat": false,
      "numerator": 4,
      "denominator": 4
    },
    {
      "tick": 4800,
      "bar": 3,
      "beat": 3,
      "downbeat": false,
      "numerator": 4,
      "denominator": 4
    },
    {
      "tick": 5280,
      "bar": 3,
      "beat": 4,
      "downbeat": false,
      "numerator": 4,
      "denominator": 4
    },
    {
      "tick": 5760,
      "bar": 4,
      "beat": 1,
      "downbeat": true,
      "numerator": 4,
      "denominator": 4
    },
    {
      "tick": 6240,
      "bar": 4,
      "beat": 2,
      "downbeat": false,
      "numerator": 4,
      "denominator": 4
    },
    {
      "tick": 6720,
      "bar": 4,
      "beat": 3,
      "downbeat": false,
      "numerator": 4,
      "denominator": 4
    },
    {
      "tick": 7200,
      "bar": 4,
      "beat": 4,
      "downbeat": false,
      "numerator": 4,
      "denominator": 4
    },
    {
      "tick": 7680,
      "bar": 5,
      "beat": 1,
      "downbeat": true,
      "numerator": 4,
      "denominator": 4
    },
    {
      "tick": 8160,
      "bar": 5,
      "beat": 2,
      "downbeat": false,
      "numerator": 4,
      "denominator": 4
    },
    {
      "tick": 8640,
      "bar": 5,
      "beat": 3,
      "downbeat": false,
      "numerator": 4,
      "denominator": 4
    },
    {
      "tick": 9120,
      "bar": 5,
      "beat": 4,
      "downbeat": false,
      "numerator": 4,
      "denominator": 4
    },
    {
      "tick": 9600,
      "bar": 6,
      "beat": 1,
      "downbeat": true,
      "numerator": 4,
      "denominator": 4
    },
    {
      "tick": 10080,
      "bar": 6,
      "beat": 2,
      "downbeat": false,
      "numerator": 4,
      "denominator": 4
    },
    {
      "tick": 10560,
      "bar": 6,
      "beat": 3,
      "downbeat": false,
      "numerator": 4,
      "denominator": 4
    },
    {
      "tick": 11040,
      "bar": 6,
      "beat": 4,
      "downbeat": false,
      "numerator": 4,
      "denominator": 4
    },
    {
      "tick": 11520,
      "bar": 7,
      "beat": 1,
      "downbeat": true,
      "numerator": 4,
      "denominator": 4
    },
    {
      "tick": 12000,
      "bar": 7,
      "beat": 2,
      "downbeat": false,
      "numerator": 4,
      "denominator": 4
    },
    {
      "tick": 12480,
      "bar": 7,
      "beat": 3,
      "downbeat": false,
      "numerator": 4,
      "denominator": 4
    },
    {
      "tick": 12960,
      "bar": 7,
      "beat": 4,
      "downbeat": false,
      "numerator": 4,
      "denominator": 4
    },
    {
      "tick": 13440,
      "bar": 8,
      "beat": 1,
      "downbeat": true,
      "numerator": 4,
      "denominator": 4
    },
    {
      "tick": 13920,
      "bar": 8,
      "beat": 2,
      "downbeat": false,
      "numerator": 4,
      "denominator": 4
    },
    {
      "tick": 14400,
      "bar": 8,
      "beat": 3,
      "downbeat": false,
      "numerator": 4,
      "denominator": 4
    },
    {
      "tick": 14880,
      "bar": 8,
      "beat": 4,
      "downbeat": false,
      "numerator": 4,
      "denominator": 4
    }
  ],
  "key": {
    "root": 0,
    "mode": "major",
    "name": "C",
    "confidence": 1.0,
    "source": "duration-weighted-pitch-class-profile"
  },
  "chordCells": [
    {
      "cellIndex": 0,
      "bar": 1,
      "part": 1,
      "startTick": 0,
      "endTick": 960,
      "numerator": 4,
      "denominator": 4,
      "symbol": "C",
      "root": 0,
      "quality": "major",
      "bass": 0,
      "confidence": 0.9988,
      "coverage": 1.0,
      "nonChordToneRatio": 0.0,
      "modalBorrowing": false,
      "alternatives": [
        {
          "symbol": "Cadd9",
          "score": 0.85799
        },
        {
          "symbol": "Cmaj7",
          "score": 0.85799
        },
        {
          "symbol": "C6",
          "score": 0.85799
        }
      ],
      "uncertainty": [],
      "noteEvidenceCount": 5,
      "evidenceWeights": {
        "bass": 1282.5,
        "harmony": 2820.0,
        "melody": 81.6
      },
      "analysisVelocityUsed": false,
      "decision": "ACCEPT"
    },
    {
      "cellIndex": 1,
      "bar": 1,
      "part": 2,
      "startTick": 960,
      "endTick": 1920,
      "numerator": 4,
      "denominator": 4,
      "symbol": "F",
      "root": 5,
      "quality": "major",
      "bass": 5,
      "confidence": 0.9988,
      "coverage": 1.0,
      "nonChordToneRatio": 0.0,
      "modalBorrowing": false,
      "alternatives": [
        {
          "symbol": "Fadd9",
          "score": 0.85799
        },
        {
          "symbol": "Fmaj7",
          "score": 0.85799
        },
        {
          "symbol": "F6",
          "score": 0.85799
        }
      ],
      "uncertainty": [],
      "noteEvidenceCount": 5,
      "evidenceWeights": {
        "bass": 1282.5,
        "harmony": 2820.0,
        "melody": 81.6
      },
      "analysisVelocityUsed": false,
      "decision": "ACCEPT"
    },
    {
      "cellIndex": 2,
      "bar": 2,
      "part": 1,
      "startTick": 1920,
      "endTick": 2880,
      "numerator": 4,
      "denominator": 4,
      "symbol": "G7",
      "root": 7,
      "quality": "dominant-seventh",
      "bass": 7,
      "confidence": 0.9541,
      "coverage": 1.0,
      "nonChordToneRatio": 0.0,
      "modalBorrowing": false,
      "alternatives": [
        {
          "symbol": "G",
          "score": 0.85606
        },
        {
          "symbol": "Gadd9",
          "score": 0.73656
        },
        {
          "symbol": "G6",
          "score": 0.73656
        }
      ],
      "uncertainty": [],
      "noteEvidenceCount": 6,
      "evidenceWeights": {
        "bass": 1282.5,
        "harmony": 3760.0,
        "melody": 81.6
      },
      "analysisVelocityUsed": false,
      "decision": "ACCEPT"
    },
    {
      "cellIndex": 3,
      "bar": 2,
      "part": 2,
      "startTick": 2880,
      "endTick": 3840,
      "numerator": 4,
      "denominator": 4,
      "symbol": "Cmaj7",
      "root": 0,
      "quality": "major-seventh",
      "bass": 0,
      "confidence": 0.9541,
      "coverage": 1.0,
      "nonChordToneRatio": 0.0,
      "modalBorrowing": false,
      "alternatives": [
        {
          "symbol": "C",
          "score": 0.85606
        },
        {
          "symbol": "Cadd9",
          "score": 0.73656
        },
        {
          "symbol": "C6",
          "score": 0.73656
        }
      ],
      "uncertainty": [],
      "noteEvidenceCount": 6,
      "evidenceWeights": {
        "bass": 1282.5,
        "harmony": 3760.0,
        "melody": 81.6
      },
      "analysisVelocityUsed": false,
      "decision": "ACCEPT"
    },
    {
      "cellIndex": 4,
      "bar": 3,
      "part": 1,
      "startTick": 3840,
      "endTick": 4800,
      "numerator": 4,
      "denominator": 4,
      "symbol": "Am",
      "root": 9,
      "quality": "minor",
      "bass": 9,
      "confidence": 0.9988,
      "coverage": 1.0,
      "nonChordToneRatio": 0.0,
      "modalBorrowing": false,
      "alternatives": [
        {